{
  "format": 1,
  "id": "123",
  "name": "Моя игра",
  "subtitle": "Сервер из меню игры",
  "icon": "gamepad",
  "version": "1.0.0",
  "author": "By./UDAV TimeRust",
  "ports": [
    { "id": "game", "protocol": "udp", "default": 7777, "expose": true }
  ],
  "join": { "menuPath": [ "Сетевая игра", "Подключиться по адресу" ], "template": "{address}" },
  "guide": {
    "hint": "Хост запускает сервер прямо из игры",
    "startSteps": [
      "Запустите игру и создайте сетевую игру; порт оставьте 7777.",
      "Вернитесь сюда и нажмите «Проверить снова»."
    ],
    "stoppedTips": [
      "Проверьте, не закрылась ли игра.",
      "Запустите сетевую игру снова и нажмите «Проверить снова»."
    ]
  }
}
