{
  "$schema": "https://raw.githubusercontent.com/kreker0001/ConnectTogether-Addons/main/schema/addon.schema.json",
  "format": 1,
  "id": "terraria",
  "name": "Terraria",
  "subtitle": "Свой сервер TerrariaServer.exe",
  "icon": "gamepad",
  "version": "1.0.0",
  "author": "Команда ConnectTogether",
  "ports": [ { "id": "game", "protocol": "tcp", "default": 7777, "expose": true } ],
  "join": { "menuPath": [ "Мультиплеер", "Присоединиться по IP" ] },
  "guide": {
    "hint": "Сервер запускаете вы, адрес друзьям даёт ConnectTogether",
    "startSteps": [
      "Запустите TerrariaServer.exe из папки игры и выберите мир.",
      "На вопрос о порте оставьте 7777, на вопрос о пробросе портов ответьте «n» — ConnectTogether сделает это сам.",
      "Вернитесь сюда и нажмите «Проверить снова»."
    ],
    "stoppedTips": [
      "Проверьте, не закрылось ли окно TerrariaServer.exe.",
      "Запустите сервер с тем же миром — комната и код останутся прежними.",
      "Нажмите «Проверить снова»."
    ],
    "helpUrl": "https://terraria.wiki.gg/wiki/Server",
    "helpLabel": "Как запустить сервер Terraria"
  }
}
